麻黄,发汗散寒，宣肺平喘，利水消肿。
香薷,发汗解表，化湿和中。
桂枝,发汗解肌，温通经脉，助阳化气，平冲降气。
紫苏叶,解表散寒，行气和胃。
紫苏梗,理气宽中，止痛，安胎。
荆芥,解表散风，透疹，消疮。
荆芥穗,解表散风，透疹，消疮。
荆芥炭,收敛止血。
防风,祛风解表，胜湿止痛，止痉。
羌活,解表散寒，祛风除湿，止痛。
独活,祛风除湿，同痹止痛。
白芷,解表散寒，祛风止痛，宣通鼻窍，燥湿止带，消肿排脓。
细辛,解表散寒，祛风止痛，通窍，温肺化饮。
生姜,解表散寒，温中止呕，化痰止咳，解鱼蟹毒。
苍耳子,散风寒，通鼻窍，祛风湿。
辛夷,散风寒，通鼻窍。
鹅不食草,发散风寒，通鼻窍，止咳。
藁本,祛风，散寒，除湿，止痛。
菊花,散风清热，平肝明目，清热解毒。
野菊花,泻火平肝，清热解毒。
桑叶,疏散风热，清肺润燥，清肝明目。
薄荷,疏散风热，清利头目，利咽，透疹，疏肝行气。
牛蒡子,疏散风热，解毒利咽，宣肺透疹。
蝉蜕,疏散风热，利咽，透疹，明目退翳，解痉。
蛇蜕,祛风，定惊，解毒，退翳。
蔓荆子,疏散风热，清利头目。
木贼,疏散风热，明目退翳。
谷精草,疏散风热，明目退翳。
罗汉果,清热润肺，利咽开音，滑肠通便。
胖大海,清热润肺，利咽开音，润肠通便。
木蝴蝶,清肺利咽，疏肝和胃。
马勃,清肺利咽，止血。
柴胡,疏散退热，疏肝解郁，升举阳气。
升麻,发表透疹，清热解毒，升举阳气。
葛根,解肌退热，生津止渴，升阳止泻，透疹，解酒毒，通经活络。
贯叶金丝桃,疏肝解郁，清热利湿，消肿通乳。
蒺藜,平肝解郁，活血祛风，明目，止痒。
蕤仁,疏风散热，养肝明目。
淡豆豉,解表，除烦，宣发郁热。
浮萍,宣散风热，透疹，利尿。
西河流,发表透疹，祛风除湿。
寒水石,清热泻火。
石膏,清热泻火，除烦止渴。
煅石膏,收湿，生肌敛疮，止血。
知母,清热泻火，滋阴润燥。
淡竹叶,清热泻火，除烦止渴，利尿通淋。
鸭跖草,清热泻火，解毒，利水消肿。
芦根,清热泻火，生津止渴，除烦，止呕，利尿。
天花粉,清热泻火，生津止渴，消肿排脓。
西瓜霜,清热泻火，消肿止痛。
西青果,清热生津，解毒。
青果,清热解毒，利咽，生津。
栀子,泻火除烦，清热利湿，凉血解毒，外用消肿止痛。
焦栀子,凉血止血。
谷精草,疏散风热，明目退翳。
密蒙花,清热泻火，养肝明目，退翳。
青葙子,清肝泻火，明目退翳。
夏枯草,清肝泻火，明目，散结消肿。
决明子,清热明目，润肠通便。
菥蓂,清肝明目，和中利湿，解毒消肿。
菊苣,清肝利胆，健胃消食，利尿消肿。
功劳木,清热燥湿，泻火解毒。
三颗针,清热燥湿，泻火解毒。
黄芩,清热燥湿，泻火解毒，止血，安胎。
黄连,清热燥湿，泻火解毒。
黄柏,清热燥湿，泻火除蒸，解毒疗疮。
龙胆,清热燥湿，泻肝胆火。
红花龙胆,清热除湿，解毒，止咳。
金龙胆草,清热化痰，止咳平喘，凉血止血，解毒利湿。
苦参,清热燥湿，杀虫，利尿。
苦玄参,清热解毒，消肿止痛。
玄参,清热凉血，滋阴降火，解毒散结。
白鲜皮,清热燥湿，祛风解毒。
秦皮,清热燥湿，收涩止痢，止带，明目。
椿皮,清热燥湿，收敛止带，止泻，止血。
鲜地黄,清热生津，凉血，止血。
生地黄,清热凉血，养阴生津。
熟地黄,补血滋阴，益精填髓。
玄参,清热凉血，滋阴降火，解毒散结。
牡丹皮,清热凉血，活血化瘀。
赤芍,清热凉血，散瘀止痛。
紫草,清热凉血，活血解毒，透疹消斑。
肿节风,清热凉血，活血消斑，祛风通络。
大青盐,清热，凉血，明目。
白薇,清热凉血，利尿通淋，解毒疗疮。
水牛角,清热凉血，解毒，定惊。
木芙蓉叶,凉血，解毒，消肿，止痛。
余甘子,清热凉血，消食健胃，生津止咳。
荷叶,清暑化湿，升发清阳，凉血止血。
荷叶炭,收涩化瘀止血。
金银花,清热解毒，疏散风热。
忍冬藤,清热解毒，疏风通络。
一枝黄花,清热解毒，疏散风热。
连翘,清热解毒，疏散风热，消肿散结。
板蓝根,清热解毒，凉血利咽。
南板蓝根,清热解毒，凉血，消斑。
大青叶,清热解毒，凉血消斑。
青黛,清热解毒，凉血消斑，泻火定惊。
拳参,清热解毒，消肿，止血。
白蔹,清热解毒，敛疮生肌，消痈散结。
天葵子,清热解毒，消肿散结。
冬葵子,利尿通淋，下乳，润肠通便。
苦地丁,清热解毒，散结消肿。
紫花地丁,清热解毒，凉血消肿。
筋骨草,清热解毒，凉血消肿。
穿心莲,清热解毒，凉血，消肿。
漏芦,清热解毒，消痈，下乳，舒筋通脉。
蒲公英,清热解毒，利尿通淋，消肿散结。
鱼腥草,清热解毒，利尿通淋，消痈排脓。
白花蛇舌草,清热解毒，消痈散结，利水。
败酱草,清热解毒，利尿消肿，活血止痛。
木鳖子,散结消肿，攻毒疗疮。
皂角刺,消肿脱毒，排脓，杀虫。
狼毒,杀虫，散结。
重楼,清热解毒，消肿止痛，凉肝定惊。
黄药,清热解毒，化痰散结，凉血止血。
山慈菇,清热解毒，化痰散结。
猫爪草,化痰散结，解毒消肿。
人工牛黄,清热解毒，化痰定惊。
金荞麦,清热解毒，排脓祛瘀。
四季青,清热解毒，消肿祛瘀。
半枝莲,清热解毒，化瘀利尿。
半边莲,清热解毒，利尿消肿。
三白草,清热解毒，利尿消肿。
杠板归,清热解毒，利尿消肿，止咳。
臭灵丹草,清热解毒，止咳祛痰。
高山辣根菜,清热解毒，清肺止咳，消肿，止血。
绵马贯众,清热解毒，驱虫。
绵马贯炭,收涩止血。
紫萁贯众,清热解毒，杀虫止血。
土茯苓,解毒，除湿，通利关节。
马齿苋,清热解毒，凉血止血，止痢。
地锦草,清热解毒，凉血止血，利湿退黄。
救必应,清热解毒，利湿止痛。
飞扬草,清热解毒，利湿止痒。
千里光,清热解毒，利湿，明目。
苘麻子,清热解毒，利湿，退翳。
翼首草,解毒除瘟，清热止痢。
鸦胆子,清热解毒，止痢，劫疟，外用腐蚀赘疣。
白头翁,清热解毒，凉血止痢。
委陵菜,清热解毒，凉血止痢。
翻白草,清热解毒，止血，止痢
苦木,清热解毒，祛湿。
洪连,清热，解毒，利湿，平肝，行血，调经。
射干,清热解毒，消痰利咽。
山豆根,清热解毒，消肿利咽。
北豆根,清热解毒，祛风止痛。
山香圆叶,清热解毒，活血止痛，利咽消肿。
马勃,清肺利咽，止血。
木蝴蝶,清肺利咽，疏肝和胃。
锦灯笼,清热解毒，利尿通淋，利咽化痰。
青果,清热解毒，利咽，生津。
西青果,清热生津，解毒。
金果榄,清热解毒，利咽，止痛。
大血藤,清热解毒，活血，祛风止痛。
冬凌草,清热解毒，活血止痛。
黄藤,清热解毒，泻火通便。
青蒿,清虚热，除骨蒸，解暑热，劫疟，退黄。
地骨皮,清肺降火，凉血除蒸。
银柴胡,清虚热，除疳热。
胡黄连,清湿热，退虚热，除疳热。
大黄,泻下攻积，清热泻火，凉血解毒，利湿退黄，逐瘀通经。
芒硝,泻下通便，清火消肿，润燥软坚。
玄明粉,泻下通便，清火消肿，润燥软坚。
芦荟,泻下通便，清肝泻火，杀虫疗疳。
番泻叶,泻热行滞，通便，利水。
蓖麻子,泻下通滞，消肿拔毒。
亚麻子,润燥通便，养血祛风。
火麻仁,润肠通便。
郁李仁,润肠通便，下气利水。
大戟,泻水逐饮，消肿散结。
甘遂,泻水逐饮，消肿散结。
芫花,泻水逐饮，外用杀虫疗疮。
千金子,泻下逐水，破血消徵。
牵牛子,泻水通便，消痰涤饮，杀虫攻积。
商陆,逐水消肿，通利二便，外用解毒散结。
巴豆,竣下冷积，豁痰利咽，逐水退肿，外用蚀疮。
独活,祛风除湿，通痹止痛。
羌活,解表散寒，祛风除湿，止痛
油松节,祛风除湿，通络止痛。
丁公藤,祛风除湿，消肿止痛。
雷公藤,祛风除湿，活血通络，杀虫解毒，消肿止痛。
防己,祛风止痛，利水消肿。
制川乌,祛风除湿，温经止痛。
制草乌,祛风除湿，温经止痛。
草乌叶,清热，解毒，止痛。
地枫皮,祛风除湿，行气止痛。
闹羊花,祛风除湿，散瘀止痛。
金铁锁,祛风除湿，散瘀止痛，解毒消肿。
朱砂根,祛风除湿，活血止痛，解毒消肿。
秦艽,祛风湿，止痹痛，清湿热，退虚热。
徐长卿,祛风，化湿，止痛，止痒。
威灵仙,祛风湿，通经络。
老鹳草,祛风湿，通经络，止泻痢。
臭梧桐,祛风湿，通经络，降血压。
伸筋草,祛风除湿，舒筋活络。
穿山龙,祛风除湿，舒筋活络，活血止痛，止咳平喘。
夏天无,祛风除湿，舒筋活络，活血止痛。
木瓜,舒筋活络，和胃化湿。
野木瓜,祛风止痛，舒筋活络。
络石藤,祛风通络，凉血消肿。
青风藤,祛风湿，通经络，利小便。
海风藤,祛风湿，通经络，止痹痛。
路路通,祛风活络，利水，通经。
蕲蛇,祛风，通络，止痉。
金钱白花蛇,祛风，通络，止痉。
乌梢蛇,祛风，通络，止痉。
桑寄生,祛风湿，补肝肾，强筋骨，安胎元。
槲寄生,祛风湿，补肝肾，强筋骨，安胎元。
鹿衔草,祛风湿，强筋骨，止咳，止血。
香加皮,祛风湿，强筋骨，利水消肿。
五加皮,祛风除湿，补益肝肾，强筋壮骨，利水消肿。
千年健,祛风湿，壮筋骨。
狗脊,祛风湿，补肝肾，强腰膝。
桑枝,祛风湿，利关节。
豨签草,祛风湿，利关节，解毒。
丝瓜络,祛风通络，活血，下乳。
两头尖,祛风湿，消痈肿。
苍术,燥湿健脾，祛风散寒，明目。
白术,健脾益气，燥湿利水，止汗，安胎。
厚朴,燥湿消痰，下气除满。
厚朴花,理气宽中，芳香化湿。
广藿香,芳香化浊，和中止呕，发表解暑。
佩兰,芳香化湿，醒脾开胃，发表解暑。
砂仁,化湿开胃，温脾止泻，理气安胎。
豆蔻,化湿行气，温中止呕，开胃消食。
红豆蔻,散寒燥湿，醒脾消食。
草豆蔻,燥湿行气，温中止呕。
肉豆蔻,温中行气，涩肠止泻。
草果,燥湿温中，劫疟除痰。
冬瓜皮,利水消肿。
茯苓皮,利水消肿。
三百草,利水消肿，清热解毒。
杠板归,利水消肿，清热解毒，止咳。
茯苓,利水渗湿，健脾，宁心。
赤小豆,利水消肿，解毒排脓。
猪苓,利水渗湿。
泽泻,利水渗湿，泄热，化浊降脂。
薏苡仁,利水渗湿，健脾止泻，除痹，排脓，解毒散结。
粉萆薢,利湿去浊，祛风除痹。
绵萆薢,利湿去浊，祛风除痹。
菝葜,利湿去浊，祛风除痹，解毒散瘀。
云芝,健脾利湿，清热解毒。
白扁豆,健脾化湿，和中消暑。
车前子,清热利尿通淋，渗湿止泻，明目，祛痰。
车前草,清热利尿通淋，凉血，解毒，祛痰。
积雪草,清热利湿，解毒消肿。
地肤子,清热利湿，祛风止痒。
青叶胆,清热利湿，清肝利胆。
大豆黄卷,清热利湿，解表祛暑。
木棉花,清热利湿，解毒。
海金沙,清利湿热，通淋止痛。
黄蜀葵花,清利湿热，消肿解毒。
冬葵果,清热利尿，消肿。
通草,清热利尿，通气下乳。
小通草,清热，利尿，下乳。
当药,清湿热，健胃。
灯心草,清心火，利小便。
蓍草,解毒利湿，活血止痛。
木通,利尿通淋，通经下乳，清心除烦。
滑石,利尿通淋，清热解暑，外用祛湿敛疮。
滑石粉,利尿通淋，清热解暑，外用祛湿敛疮。
瞿麦,利尿通淋，活血通经。
萹蓄,利尿通淋，杀虫，止痒。
广金钱草,利尿通淋，利湿退黄
金钱草,利尿通淋，利湿退黄，解毒消肿。
石韦,利尿通淋，清肺止咳，凉血止血。
茵陈,清利湿热，利胆退黄。
广金钱草,利尿通淋，利湿退黄
金钱草,利尿通淋，利湿退黄，解毒消肿。
垂盆草,利湿退黄，清热解毒。
鸡骨草,利湿退黄，清热解毒，疏肝止痛。
虎杖,利湿退黄，清热解毒，散瘀止痛，止咳化痰。
连钱草,利湿通淋，清热解毒，散瘀消肿。
附子,回阳救逆，补火助阳，散寒止痛。
肉桂,补火助阳，散寒止痛，温经通脉，引火归元。
干姜,回阳通脉，温中散寒，温肺化饮。
吴茱萸,散寒止痛，助阳止泻，降逆止呕。
高良姜,散寒止痛，温胃止呕。
小茴香,散寒止痛，理气和胃。
胡椒,温中散寒，下气，消痰。
辣椒,温中散寒，开胃消食。
荜茇,温中散寒，下气止痛。
荜澄茄,温中散寒，行气止痛。
八角茴香,温阳散寒，行气止痛。
葫芦巴,温肾助阳，祛寒止痛。
炮姜,温中止痛，温经止血。
花椒,温中止痛，杀虫，止痒。
丁香,温中降逆，补肾助阳。
母丁香,温中降逆，补肾助阳
刀豆,稳中，下气，止呃。
芥子,温肺豁痰利气。散结通络止痛。
乌药,行气止痛，温肾散寒。
荔枝核,行气散结，祛寒止痛。
橘核,理气，散结，止痛。
陈皮,理气健脾，燥湿化痰。
化橘红,理气宽中，燥湿化痰。
橘红,行气宽中，燥湿化痰，发表散寒。
青皮,疏肝破气，消积化滞。
枳实,破气消积，化痰散痞。
枳壳,理气宽中，行滞消胀。
木香,行气止痛，健脾消食。
川木香,行气止痛。
青木香,行气止痛，解毒消肿。
土木香,行气止痛，健脾和胃，安胎。
沉香,行气止痛，温中止呕，纳气平喘。
九里香,行气止痛，活血散瘀。
降香,理气止痛，化瘀止血。
九香虫,理气止痛，温中助阳。
黄药,理气止痛，解毒消肿。
甘松,理气止痛，开郁醒脾，外用祛湿消肿。
蜘蛛香,理气止痛，消食止泻，祛风除湿，镇惊安神。
檀香,行气温中，开胃止痛。
山奈,行气温中，消食，止痛。
玫瑰花,行气解郁，和血，止痛。
月季花,活血调经，疏肝解郁。
大腹皮,行气宽中，行水消肿。
槟榔,杀虫，消积，行气，利水。
薤白,行气导滞，通阳散结。
娑罗子,疏肝理气，和胃止痛。
佛手,疏肝理气，和胃止痛，燥湿化痰。
预知子,疏肝理气，活血止痛，散结，利尿。
香橼,疏肝理气，宽中化痰。
香附,疏肝解郁，调经止痛，理气宽中。
川楝子,疏肝泄热，行气止痛，杀虫。
梅花,舒肝和中，化痰散结。
大蓟,凉血止血，散瘀解毒消痈。
大蓟炭,凉血止血。
小蓟,凉血止血，散于解毒消痈。
地榆,凉血止血，解毒敛疮。
瓦松,凉血止血，解毒敛疮。
侧柏叶,凉血止血，生发乌发，化痰止咳、
槐花,凉血止血，清肝泻火。
槐角,凉血止血，清热泻火。
白茅根,凉血止血，清热利尿。
苎麻根,凉血止血，清热安胎，利尿解毒。
三七,散瘀止血，消肿定痛。
景天三七,散瘀止血，宁心安神，解毒。
大叶紫珠,散瘀止血，消肿止痛。
竹节参,散瘀止血，消肿止痛，祛痰止咳，补虚强壮。
茜草,凉血，止血，祛瘀，通经。
蒲黄,化瘀，止血，通淋。
断血流,凉血止血。
棕榈,凉血止血。
白及,收敛止血，消肿生肌。
仙鹤草,收敛止血，止痢，劫疟，解毒，补虚。
鸡冠花,收敛止血，止痢，止带。
广东紫珠,收敛止血，散瘀，清热解毒。
紫珠叶,凉血收敛止血，散瘀解毒，消肿。
血余炭,收敛止血，化瘀，利尿。
松花粉,收敛止血，燥湿敛疮。
藕节,收敛止血，化瘀。
艾叶,温经止血，散寒止痛，外用祛湿止痒。
川芎,活血行气，祛风止痛。
独一味,活血止血，祛风止痛。
延胡索,活血，行气，止痛。
天仙藤,行气活血，通络止痛。
天仙子,解痉止痛，平喘，安神。
灯盏花,活血通络止痛，祛风散寒。
灯盏细辛,活血通络止痛，祛风散寒。
郁金,活血止痛，行气解郁，清心凉血，利胆退黄。
儿茶,活血止痛，止血生肌，收湿敛疮，清肺化痰。
五灵脂,活血止痛，止血，解蛇虫毒。
枫香脂,活血止痛，凉血止血，解毒生肌。
血竭,活血定痛，化瘀止血，生肌敛疮。
乳香,活血定痛，消肿生肌。
没药,散瘀定痛，消肿生肌。
马鞭草,活血散瘀，解毒，截疟，利水，退黄。
山楂叶,活血化瘀，理气通脉，化浊降脂。
银杏叶,活血化瘀，通络止痛，敛肺平喘，化浊降脂。
两面针,活血化瘀，行气止痛，祛风通络，解毒消肿。
西红花,活血化瘀，凉血解毒，解郁安神。
丹参,活血祛瘀，通经止痛，清心除烦，凉血消痈。
北刘寄奴,活血祛瘀，通经止痛，凉血止血，清热利湿。
桃仁,活血祛瘀，止咳平喘，润肠通便。
桃枝,活血通络，解毒杀虫。
苏木,活血祛瘀，消肿止痛。
卷柏,活血通经，化瘀止血。
凌霄花,活血通经，凉血祛风。
红花,活血通经，散瘀止痛。
西红花,活血化瘀，凉血解毒，解郁安神。
王不留行,活血通经，下乳消肿，利尿通淋。
月季花,活血调经，疏肝解郁。
玫瑰花,行气解郁，和血，止痛。
益母草,活血调经，清热解毒，利尿消肿。
泽兰,活血调经，利水消肿，祛瘀消痈。
茺蔚子,活血调经，清肝明目。
小叶莲,调经活血。
牛膝,逐瘀通经，补肝肾，强筋骨，利尿通淋，引血下行。
川牛膝,逐瘀通经，通利关节，利尿通淋。
鸡血藤,活血补血，调经止痛，舒经活络。
穿山甲,活血消徵，通经下乳，消肿排脓，搜风通络。
干漆,破血通经，消积杀虫。
马钱子,散结消肿，通络止痛。
水红花子,散结消徵，消积止痛，利水消肿。
水蛭,破血通经，逐瘀消癥。
土鳖虫,破血逐瘀，续筋接骨。
自然铜,散瘀止痛，续筋接骨。
斑蝥,破血逐瘀，散结消癥，攻毒蚀疮。
急性子,破血，软坚，消积。
骨碎补,补肾强骨，疗伤止痛，外用消风祛斑。
莪术,行气破血，消积止痛。
三棱,行气破血，消积止痛。
姜黄,破血行气，通经止痛。
石决明,平肝潜阳，清肝明目。
珍珠母,平肝潜阳，明目退翳，安神定惊
珍珠,安神定惊，明目消翳，润肤祛斑，解毒生肌。
赭石,平肝潜阳，重镇降逆，凉血止血。
牡蛎,潜阳补阴，软坚散结，重镇安神。
羚羊角,平肝息风，散血解毒，清肝明目。
天麻,息风止痉，祛风通络，平抑肝阳。
钩藤,息风定惊，清热平肝。
僵蚕,息风止痉，祛风止痛，化痰散结。
地龙,清热定惊，平喘，通络，利尿。
全蝎,息风镇痉，攻毒散结，通络止痛。
蜈蚣,息风镇痉，攻毒散结，通络止痛。
麝香,开窍醒神，活血通经，消肿止痛。
冰片,开窍醒神，清热止痛。
安息香,开窍醒神，行气活血，止痛。
石菖蒲,开窍豁痰，醒神益智，化湿开胃。
牛黄,开窍，豁痰，清心，解毒，凉肝，息风。
人工牛黄,清热解毒，化痰定惊。
苏合香,开窍，辟秽，止痛。
蟾酥,开窍醒神，解毒，止痛。
人参,大补元气，复脉固脱，补脾益肺，安神益智，生津养血。
人参叶,补气，益肺，祛暑，生津。
红参,大补元气，复脉固脱，益气摄血。
西洋参,补气养阴，清热生津。
党参,健脾益肺，养血生津。
太子参,益气健脾，生津益肺。
刺五加,益气健脾，补肾安神。
蓝布正,益气健脾，补血养阴，润肺化痰。
明党参,润肺化痰，养阴和胃，平肝，解毒。
黄芪,补气升阳，固表止汗，利水消肿，托毒排脓，敛疮生肌，行滞通痹，生津养血。
红芪,补气升阳，固表止汗，利水消肿，托毒排脓，敛疮生肌，行滞通痹，生津养血。
炙红芪,补中益气。
炙黄芪,益气补中。
大枣,补中益气，养血安神。
广枣,行气活血，养心安神。
蜂蜜,补中，润燥，解毒，止痛，外用生肌敛疮。
白术,健脾益气，燥湿利水，止汗，安胎。
白扁豆,健脾化湿，和中消暑。
甘草,补脾益气，清热解毒，祛痰止咳，调和诸药，缓急止痛。
炙甘草,益气复脉，补脾和胃。
毛诃子,收敛养血，清热解毒，调和诸药。
山药,补肾涩精，补脾养胃，生津益肺。
灵芝,补气安神，止咳平喘。
云芝,清热解毒，健脾利湿。
天仙子,解痉止痛，平喘，安神。
天仙藤,行气活血，通络止痛。
红景天,益气活血，通脉平喘。
龙眼肉,补益心脾，养血安神。
枸骨叶,清热养阴，益肾，平肝。
榼藤子,补气补血，健胃消食，除风止痛，强筋硬骨。
当归,补血活血，调经止痛，润肠通便。
何首乌,解毒，截疟，消痈，润肠通便。
制何首乌,补肝肾，强筋骨，益精血，乌须发，化浊降脂。
首乌藤,祛风通络，养血安神。
白芍,养血调经，敛阴止汗，平抑肝阳，柔肝止痛。
熟地黄,补血滋阴，益精填髓。
阿胶,补血滋阴，润燥，止血。
桑椹,滋阴补血，生津润燥。
枸杞子,滋补肝肾，益精明目。
蛤蟆油,补肾益精，养阴润肺。
北沙参,养阴清肺，益胃生津。
南沙参,养阴清肺，益胃生津，益气，化痰。
珠子参,补肺养阴，祛瘀止痛，止血。
百合,养阴润肺，清心安神。
麦冬,润肺清心，养阴生津。
天冬,养阴润燥，清肺生津，
玉竹,养阴润燥，生津止渴。
墨旱莲,滋补肝肾，凉血止血。
女贞子,滋补肝肾，明目乌发。
枸杞子,滋补肝肾，益精明目。
黑豆,益精明目，养血祛风，利水，解毒。
黑种草子,补肾健脑，通经，通乳，利尿。
石斛,滋阴清热，益胃生津。
黄精,补气养阴，健脾，润肺，益肾。
鳖甲,滋阴潜阳，软坚散结，退热除蒸。
龟甲,滋阴潜阳，益肾强骨，养血补心，固经止崩。
龟甲胶,滋阴，养血，止血。
鹿茸,壮肾阳，益精血，强筋骨，调冲任，托疮毒。
鹿角,温肾阳，强筋骨，行血消肿。
鹿角胶,温补肝肾，益精养血，止血。
韭菜子,温补肝肾，壮阳固精。
鹿角霜,温肾助阳，收敛止血。
补骨脂,温肾助阳，温脾止泻，纳气平喘，外用消风祛斑。
海马,温肾壮阳，散结消肿。
海龙,温肾壮阳，散结消肿。
沙苑子,补肾助阳，固精缩尿，养肝明目。
菟丝子,补益肝肾，固精缩尿，明目，安胎，止泻。
肉豆蔻,补肾阳，益精血，润肠通便。
锁阳,补肾阳，益精血，润肠通便。
仙茅,补肾阳，强筋骨，祛寒湿。
淫羊藿,补肾阳，强筋骨，祛风湿。
巴戟天,补肾阳，强筋骨，祛风湿。
杜仲叶,补肝肾，强筋骨。
杜仲,补肝肾，强筋骨，安胎。
续断,补肝肾，强筋骨，续折伤，止崩漏。
黑芝麻,补肝肾，强筋骨，润肠燥。
天山雪莲,补肾活血，强筋骨，营养神经，调节异常体液。
楮实子,补肾清肝，明目，利尿。
紫石英,温肾暖宫，温肺平喘，镇心安神。
冬虫夏草,补肾益肺，止血化痰。
蛤蚧,补肺益肾，助阳益精，纳气平喘。
钟乳石,温肺，助阳，平喘，制酸，通乳。
骨碎补,补肾强骨，疗伤止痛，外用消风祛斑。
益智,暖肾固精缩尿，温脾止泻摄唾。
覆盆子,益肾固精缩尿，养肝明目。
紫河车,温肾补精，益气养血。
核桃仁,益肾补肺，润肠。
半夏,燥湿化痰，降逆止呕，消痞散结。
法半夏,燥湿化痰。
姜半夏,温中化痰，降逆止呕。
天南星,散结消肿。
制天南星,燥湿化痰，祛风止痉，散结消肿。
胆南星,清热化痰，息风定惊。
猪牙皂,祛痰开窍，散结消肿。
大皂角,祛痰开窍，散结消肿。
旋覆花,降气，消痰，行水，止呕。
金沸草,降气，消痰，行水。
白前,降气，消痰，止咳。
白附子,祛风痰，定惊搐，解毒散结，止痛。
桔梗,宣肺，祛痰，利咽，排脓。
芥子,温肺豁痰利气，散结通络止痛。
花蕊石,温肺豁痰利气，散结通络止痛。
华山参,温肺祛痰，平喘止咳，安神定惊。
平贝母,清热润肺，化痰止咳。
伊贝母,清热润肺，化痰止咳。
川贝母,清热润肺，化痰止咳，散结消痈。
浙贝母,清热化痰止咳，解毒散结消痈。
湖北贝母,清热化痰，止咳，散结。
土贝母,解毒，散结，消肿。
瓜蒌,清热涤痰，宽胸散结，润燥滑肠。
瓜蒌皮,清热化痰，利气宽胸。
瓜蒌子,润肺化痰，滑肠通便。
龙脷叶,润肺止咳，通便。
甜瓜子,清热，滑肠，化瘀，排脓，疗伤止痛。
前胡,散风清热，降气化痰。
紫花前胡,散风清热，降气化痰。
昆布,消痰软坚散结，利水消肿。
海藻,消痰软坚散结，利水消肿。
竹茹,清热化痰，除烦，止呕。
天竺黄,清热豁痰，凉心定惊。
瓦楞子,消痰化瘀，软坚散结，制酸止痛。
蛤壳,清热化痰，软坚散结，制酸止痛，外用收湿敛疮。
青礞石,坠痰下气，平肝镇惊。
金礞石,坠痰下气，平肝镇惊。
金龙胆草,清热化痰，止咳平喘，解毒利湿，凉血止血。
龙胆,清热燥湿，泻肝胆火。
红花龙胆,清热除湿，解毒，止咳。
石吊兰,化痰止咳，软坚散结。
苦杏仁,降气止咳平喘，润肠通便。
