紫苏子,降气化痰，止咳平喘，润肠通便。
枇杷叶,清肺止咳，降逆止呕。
百部,润肺下气止咳，杀虫灭虱。
紫菀,润肺下气，消痰止咳。
葶苈子,泻肺平喘，行水消肿。
桑白皮,泻肺平喘，利水消肿。
白果,敛肺定喘，止带缩尿。
马兜铃,清肺降气，清肠消痔，止咳平喘。
暴马子皮,清肺祛痰，止咳平喘。
猪胆粉,清热润燥，止咳平喘，解毒。
瓜子金,祛痰止咳，活血消肿。
牡荆叶,祛痰，止咳，平喘。
野马追,化痰止咳平喘。
矮地茶,化痰止咳，清利湿热，活血化瘀。
通关藤,止咳平喘，清热解毒，祛痰，通乳。
洋金花,解痉定痛，平喘止咳。
白屈菜,解痉定痛，止咳平喘。
满山红,止咳祛痰。
山楂,消食健胃，行气散瘀，化浊降脂。
山楂叶,活血化瘀，理气通脉，化浊降脂。
莱菔子,消食除胀，降气化痰。
布渣叶,消食化滞，清热利湿。
稻芽,消食和中，健脾开胃。
神曲,消食化积
麦芽,行气消食，健脾开胃，回乳消胀。
沙棘,健脾消食，止咳祛痰，活血散瘀。
鸡内金,健胃消食，涩精止遗，通淋化石。
神曲,消食化积
使君子,杀虫消积
鹤虱,杀虫消积。
雷丸,杀虫消积。
槟榔,杀虫，消积，行气，利水。
焦槟榔,消食导滞。
榧子,杀虫消积，润燥通便，润肺止咳。
南瓜子,杀虫。
鹤草芽,杀虫。
朱砂,清心镇惊，安神，明目，解毒。
磁石,镇惊安神，平肝潜阳，聪耳明目，纳气平喘。
龙骨,镇惊安神，平肝潜阳，收涩固脱。
珍珠母,平肝潜阳，安神定惊，，明目退翳。
珍珠,安神定惊，明目消翳，润肤祛斑，解毒生肌。
合欢花,解郁安神
合欢皮,解郁安神，活血消肿。
罗布麻叶,平肝安神，清热利水。
柏子仁,养心安神，止汗，润肠通便。
酸枣仁,宁心安神，养心补肝，敛汗，生津。
远志,安神益智，交通心肾，祛痰，消肿。
莲子心,交通心肾，清心安神，涩精止血。
乌梅,敛肺，涩肠，安蛔，生津。
罂粟壳,敛肺，涩肠，止痛。
五味子,收敛固涩，补肾宁心，益气生津。
诃子,敛肺止咳，涩肠止泻，降火利咽。
海螵蛸,收敛止血，收湿敛疮，涩精止带，制酸止痛。
桑螵蛸,补肾助阳，固精缩尿。
肉豆蔻,温中行气，涩肠止泻。
五倍子,敛肺降火，敛汗，止血，涩肠止泻。
石榴皮,涩肠止泻，止血，驱虫。
赤石脂,涩肠，止血，生肌敛疮。
禹余粮,收敛止血，涩肠止泻。
莲子,益肾涩精，补脾止泻，养心安神，止带。
芡实,益肾固精，补脾止泻，除湿止带。
山茱萸,补益肝肾，收敛固脱。
莲房,化瘀止血。
莲须,固精涩精。
覆盆子,益肾固精缩尿，养肝明目。
金樱子,固精缩尿，固崩止带，涩肠止泻。
岩白菜,收敛止泻，止血止咳，舒筋活络。
麻黄根,固表止汗。
糯稻根,除热止汗，益胃生津。
浮小麦,除热止汗，益气。
椿皮,涩肠，杀虫，止血，止带，清热燥湿。
硫磺,外用解毒杀虫疗疮，内服补火助阳通便。
雄黄,解毒杀虫，燥湿祛痰，截疟。
轻粉,外用攻毒杀虫敛疮，内服祛痰消积，逐水通便。
炉甘石,解读明目退翳，收湿止痒敛疮。
皂矾,解毒燥湿，杀虫止血。
白矾,外用解毒杀虫，燥湿止痒；内服止血止泻，祛除风痰。
明矾,外用解毒杀虫，燥湿止痒；内服止血止泻，祛除风痰。
蛇床子,杀虫止痒，燥湿祛风，温肾壮阳
土荆皮,杀虫，疗廯，止痒。
苦楝皮,杀虫，疗廯。
红粉,拔毒，排脓，祛腐，生肌。
常山,涌吐痰涎，截疟。
蜂房,祛风止痛，攻毒杀虫。
蜂胶,补虚弱，化浊脂，止消渴。
蜂蜡,解毒，敛疮，生肌，止痛。
阿魏,消积，化癥，散痞，杀虫。
柿蒂,降逆止呕。
砒石,外用祛腐蚀疮，内服截疟平喘。
硼砂,外用清热解毒，内服清肺化痰。
