半边莲,半星合剂,治肺癌、肝癌、阴茎癌、黄疸水肿、臌胀、血防“846”链霉素反应
野菊花,野菊软坚汤,治肺癌、胰腺癌、肺结核、高血压、疔疮肿毒、咽喉肿痛、痈疽脓疡、肺炎、支气管炎、阑尾炎、肠风、头痛
蟾酥,蟾酥丸,治胃癌、直肠癌、白血病、喉痹、咽喉肿痛、瘰疠、腹痛吐泻、疔疮肿毒、发背痈疽、各种恶疮
斑蝥,神效癣药,治肝癌、贲门癌、胰腺癌、阴疽、流注、瘰疠、恶疮、牛皮癣、风湿痛、神经痛、疟疾、痈疽、症瘕、狂犬咬伤
昆布,宫症汤,治胃癌、鼻咽癌、食道癌、淋巴转移癌、瘰疠痰核、瘿瘤、胁下肿块、膈气、睾丸肿痛、脚气水肿
硇砂,消癌散,治胃癌、食道癌、直肠癌、痈疽肿毒、月经不通、咳吐不利、喉痹、腹胁胀满、气攻心痛、反胃呕逆、目生胬肉、鼻中息肉
石蒜,石蒜利水散,治子宫颈癌、水肿、肺结核、痔痛、痰火
铁树叶,铁乌止痢汤,治子宫颈癌、肛门癌、赤痢、便血、心胃气痛、难产
金果榄,玉枢丹,治血管瘤、脂肪瘤、卵巢恶性肿瘤、食道癌、痈疽肿毒、恶疮、各种炎症
猫爪草,百参汤,治声带癌、淋巴肉瘤、淋巴结核、瘰疠、疟疾
菝葜,菝葜散,治卵巢恶性肿瘤、胃癌、食管癌、风湿关节痛、筋骨痛、淋病、吐血、子宫脱垂
薏苡仁,加味八珍汤,治胃癌、子宫癌、喉癌、直肠癌、癌症胸腹水、绒毛膜上皮癌、肺痈、肠痈、湿痹、泄泻、头痛、水肿脚气、夜盲、蛔虫病、坐骨神经痛、鞘膜积液
野百合,养阴清肺消积汤,治胃癌、子宫颈癌、肺癌、疮疖
卷柏,软坚缩脾汤,治肝癌、胃癌、食道癌、骨癌、绒毛上皮癌、癫痫、便血、闭经、腹痛、哮喘、跌打损伤、妇女血瘕不育、子宫肌瘤
羊蹄根,羊蹄乌贼汤,治胃溃疡出血、淋病、干、湿癣，血小板减少症、疥疮、慢性气管炎
龙葵,龙葵合剂,治子宫癌、卵巢癌、肝癌、肺癌、鼻咽癌、血崩、吐血、瘰疠、痈疽恶疮、跌打扭筋
凤尾草,补肾巴戟丸,治直肠癌、子宫出血、肝炎、结膜炎、痛经、痢疾、尿路感染、瘰疠、咳嗽气喘、流感高热、赤白带下、狂犬、蛇咬伤
垂盆草,,治卵巢恶性肿瘤、肺癌、子宫脱垂、湿热黄疸、狂犬咬伤
野鸦椿,野鸦椿汤,治寒疝腹痛、睾丸肿大、产褥热、跌打损伤、脱肛、风疹
魔芋,魔芋抗癌汤,治甲状腺癌、淋巴肉瘤、鼻咽癌、脑癌、外阴癌、腹内肿块、头上痈疽、跌打扭伤、外伤、脚抽筋、毒蛇咬伤
黎罗根,一扫光汤,治血管瘤、胃癌、大肠癌、各种疮毒、癣疮、蛔虫病
三尖杉,,治淋巴肉瘤、肝癌、绒毛膜上皮癌、恶性葡萄胎、淋病、食积、产后腹胀
复盆子根,复盆饮,治乳腺癌、呕逆不食、肩疖、烫火伤
了哥王,大救驾汤,治肝癌、乳腺癌、肝硬化腹水、骨折、牙痛、臌胀、哮喘、鹤膝风
玉簪,无痛拔牙散,治乳腺癌、咽喉肿痛、小便不通、肚心痈毒、老年头昏、牙痛
石打穿,参术紫草汤,治食道癌、晚期胃癌、噎膈、急慢性肝炎、跌打疯肿、鹤膝风
猪苓,加味猪苓汤,治膀胱癌、子宫颈癌、水肿、小便不利、尿道涩痛、水湿泄泻、白带过多、呕吐、〓疟
爵床,爵龙汤,治肝癌、膀胱癌、乳糜尿、瘰疠、肾盂肾炎、血痢、肝硬化腹水、结核性肛瘘
三颗针,三马菊花汤,治结膜炎、咽喉肿痛、肠炎痢疾、湿热痹痛、无名肿毒、丹毒、湿疹、跌打瘀肿、烫伤
长春花,,治恶性淋巴瘤、何杰金氏病、白血病、蕈样霉菌病、绿色瘤、肾母细胞瘤、乳癌、腺癌、黑色素瘤
喜树,,治胃癌、肝癌、结肠癌、膀胱癌
田基黄,茵陈加减汤,治肝癌、肠痈、肺痈、湿热黄疸、跌打损伤、急性阑尾炎、中暑高热、毒蛇咬伤
朱砂根,,治喉癌、食管癌、咽喉肿痛、风湿骨节痛、劳伤吐血
景天三七,,治肺癌、尿血、跌打损伤、心烦失眠
费菜,,治胃癌、癔病、便血、跌打骨折、扭伤
草珊瑚,草珊瑚汤,治胃癌、肠癌、食管癌、肝癌、胰腺癌、直肠癌、肠系淋巴肉瘤、肠胃炎、风湿痹痛、跌打损伤、闭经、感冒
